{
  "assertion_name": "ddt.cro_binding",
  "spec_version": "0.1.0",
  "consent_receipt_ref": {
    "consent_receipt_id": "44444444-4444-4444-4444-444444444444",
    "receipt_hash": "QmJhc2U2NHVybF9leGFtcGxlX2hhc2hfMDQ",
    "hash_alg": "sha-256",
    "resolver_hint": null
  },
  "identity_context_ref": null,
  "usage_policy_summary": null,
  "revocation_reference": {
    "status_url": "https://resolver.ddt.dev/cro/status/44444444-4444-4444-4444-444444444444",
    "last_checked": null,
    "cache_ttl_seconds": null
  },
  "media_binding": {
    "asset_hash": "QmJhc2U2NHVybF9leGFtcGxlX2Fzc2V0X2hhc2hfMDQ",
    "hash_alg": "sha-256"
  },
  "extensions": {}
}
